135,Cinema Suites - The Hollywood Room,none,,2013-09-26,"Los Angeles, California, United States",within an hour,f,Mid-Wilshire,5.0,5.0,t,f,"Los Angeles, CA, United States",,Mid-Wilshire,City of Los Angeles,Los Angeles,CA,90036,Los Angeles,"Los Angeles, CA",US,United States,34.058459227417515,-118.36320608527895,t,Bed and breakfast,Private room,3,1.0,1.0,1.0,Real Bed,"{TV,""Cable TV"",Wifi,""Air conditioning"",Breakfast,Heating,""Family/kid friendly"",""Smoke detector"",Essentials,Shampoo,Hangers,""Hair dryer"",""Laptop friendly workspace"",""Bed linens"",""Extra pillows and blankets""}",$125.00,,,$0.00,$0.00,2,$20.00,1,730,1,1,730,730,1.0,730.0,t,30,60,90,365,0,0,,,,,,,,f,f,f,flexible,f,f,5,0,5,0,
136,Cinema Suites - The Small Room,none,,2013-09-26,"Los Angeles, California, United States",within an hour,f,Mid-Wilshire,5.0,5.0,t,f,"Los Angeles, CA, United States",,Carthay,City of Los Angeles,Los Angeles,CA,90036,Los Angeles,"Los Angeles, CA",US,United States,34.060312818140005,-118.36380363760055,t,Apartment,Private room,2,1.0,1.0,1.0,Real Bed,"{""Cable TV"",Wifi,""Air conditioning"",Breakfast,""Family/kid friendly"",""Smoke detector"",Essentials,Shampoo,""Bed linens"",""Extra pillows and blankets""}",$100.00,,,$0.00,$0.00,2,$0.00,1,730,1,1,730,730,1.0,730.0,t,30,60,90,365,0,0,,,,,,,,f,f,f,flexible,f,f,5,0,5,0,
137,L.A. Lifestyle--like you live here,none,,2011-01-17,"Los Angeles, California, United States",within a few hours,t,Mid-City,1.0,1.0,t,f,"Los Angeles, CA, United States",Mid-City,Mid-City,City of Los Angeles,Los Angeles,CA,90016,Los Angeles,"Los Angeles, CA",US,United States,34.03852818950432,-118.3362766369865,t,House,Entire home/apt,4,1.0,1.0,2.0,Real Bed,"{TV,""Cable TV"",Internet,Wifi,Pool,Kitchen,""Free parking on premises"",""Hot tub"",""Indoor fireplace"",Heating,Washer,Dryer,""Smoke detector"",""Carbon monoxide detector"",""First aid kit"",""Safety card"",Essentials,Shampoo,Hangers,""Hair dryer"",Iron,""Laptop friendly workspace"",""Hot water"",""Bed linens"",""Extra pillows and blankets"",""Ethernet connection""}",$97.00,$600.00,"$2,100.00",$100.00,$45.00,1,$10.00,1,30,1,1,30,30,1.0,30.0,t,9,33,50,253,510,72,96.0,10.0,9.0,10.0,10.0,10.0,10.0,f,f,f,flexible,f,f,1,1,0,0,5.35
138,Casa Periwinkle - Garden Apartment,none,"MTA public bus stop on Broadway and Solano Ave., 1/2 mile by foot at Broadway & Solano. Easy access to MTA buses. Nearest Gold Line station is in Chinatown (1 mile).",2011-01-23,"Los Angeles, California, United States",within an hour,t,,1.0,1.0,t,t,"Los Angeles, CA, United States",Cypress Park,Elysian Park,City of Los Angeles,Los Angeles,CA,90012,Los Angeles,"Los Angeles, CA",US,United States,34.07881580312297,-118.23393292033728,t,House,Entire home/apt,2,1.0,1.0,1.0,Real Bed,"{TV,""Cable TV"",Wifi,Kitchen,""Pets allowed"",""Pets live on this property"",Dog(s),""Free street parking"",Heating,Washer,Dryer,""Smoke detector"",""Carbon monoxide detector"",""First aid kit"",""Safety card"",""Fire extinguisher"",Essentials,Shampoo,Hangers,""Hair dryer"",Iron,""Laptop friendly workspace"",""translation missing: en.hosting_amenity_49"",""translation missing: en.hosting_amenity_50"",""Private entrance"",""Hot water"",""Bed linens"",""Extra pillows and blankets"",Microwave,""Coffee maker"",Refrigerator,""Dishes and silverware"",""Host greets you""}",$64.00,$400.00,"$1,200.00",$300.00,$0.00,2,$10.00,3,60,3,3,60,60,3.0,60.0,t,12,19,30,106,151,37,98.0,10.0,10.0,10.0,10.0,10.0,10.0,f,f,f,moderate,t,t,1,1,0,0,1.57
139,Amazingly reviewed private bedroom,none,"Parking is very easy and free on our street, with no permits required.  A convenient bus stop on Pico Blvd is a 5 minute walk up the street.  Getting from the airport can be done via bus but we strongly suggest taking a taxi in spite of the cost.",2011-01-28,"Los Angeles, California, United States",within an hour,t,South Robertson,3.0,3.0,t,t,"Los Angeles, CA, United States",South Robertson,Beverlywood,City of Los Angeles,Los Angeles,CA,90035,Los Angeles,"Los Angeles, CA",US,United States,34.049805232084985,-118.39744974866638,t,House,Private room,2,1.0,1.0,2.0,Real Bed,"{Internet,Wifi,""Air conditioning"",Kitchen,""Free parking on premises"",""Pets live on this property"",Cat(s),Heating,""Family/kid friendly"",Washer,Dryer,""Smoke detector"",""Carbon monoxide detector"",""First aid kit"",""Fire extinguisher"",Essentials,""Lock on bedroom door"",""24-hour check-in"",Hangers,""Laptop friendly workspace"",""Luggage dropoff allowed"",""Long term stays allowed""}",$70.00,$480.00,"$1,550.00",,$60.00,1,$10.00,7,365,7,7,365,365,7.0,365.0,t,0,0,27,302,145,7,97.0,10.0,10.0,10.0,10.0,10.0,10.0,f,f,f,moderate,f,f,3,0,3,0,1.5
140,Private bedroom with great reviews,none,"Parking is very easy and free on our street, with no permits required.  A convenient bus stop on Pico Blvd is a 5 minute walk up the street.  Getting from the airport can be done via bus but we strongly suggest taking a taxi in spite of the cost.",2011-01-28,"Los Angeles, California, United States",within an hour,t,South Robertson,3.0,3.0,t,t,"Los Angeles, CA, United States",South Robertson,Beverlywood,City of Los Angeles,Los Angeles,CA,90035,Los Angeles,"Los Angeles, CA",US,United States,34.04977838735158,-118.39744746618521,t,House,Private room,2,1.0,1.0,2.0,Real Bed,"{Internet,Wifi,""Air conditioning"",Kitchen,""Free parking on premises"",""Pets live on this property"",Cat(s),Heating,Washer,Dryer,""Smoke detector"",""Carbon monoxide detector"",Essentials,""Lock on bedroom door"",""24-hour check-in"",Hangers,""Laptop friendly workspace"",""translation missing: en.hosting_amenity_49"",""translation missing: en.hosting_amenity_50"",""Luggage dropoff allowed"",""Long term stays allowed"",""Host greets you""}",$70.00,$480.00,"$1,550.00",,$60.00,1,$10.00,7,365,7,7,365,365,7.0,365.0,t,13,13,13,223,126,7,97.0,10.0,10.0,10.0,10.0,10.0,10.0,f,f,f,moderate,f,f,3,0,3,0,1.31
141,Melrose Place in west LA Apt,none,"Bus lines, Expo line 1 mile away, off street private parking! ",2010-07-06,"Los Angeles, California, United States",within an hour,f,Westside,1.0,1.0,t,t,"Los Angeles, CA, United States",Westside,Cheviot Hills,City of Los Angeles,Los Angeles,CA,90064,Los Angeles,"Los Angeles, CA",US,United States,34.03044539035811,-118.4061770618553,t,Apartment,Private room,2,1.0,1.0,1.0,Real Bed,"{TV,""Cable TV"",Internet,Wifi,Pool,Kitchen,""Free parking on premises"",Breakfast,""Buzzer/wireless intercom"",Heating,Washer,Dryer,""Smoke detector"",""Carbon monoxide detector"",""First aid kit"",""Safety card"",""Fire extinguisher"",Essentials,Shampoo,""Lock on bedroom door"",Hangers,""Hair dryer"",Iron,""Laptop friendly workspace"",""Hot water"",""Bed linens"",""Extra pillows and blankets"",""Luggage dropoff allowed"",""Long term stays allowed"",""Step-free access"",""Wide doorway"",""Flat path to front door"",""Well-lit path to entrance"",""Step-free access"",""Wide doorway"",""Step-free access"",""Step-free access"",""Wide entryway"",""Host greets you""}",$50.00,,"$1,100.00",$0.00,$20.00,1,$0.00,25,180,21,26,180,180,22.4,180.0,t,0,0,26,115,5,1,96.0,10.0,9.0,9.0,10.0,10.0,9.0,f,t,f,moderate,f,f,1,0,1,0,0.11
142,Gorgeous Los Feliz Garden Apt!,none,,2011-02-01,"Los Angeles, California, United States",,f,Hollywood Hills,1.0,1.0,t,f,"Los Angeles, CA, United States",Hollywood,Los Feliz,City of Los Angeles,Los Angeles,CA,90027,Los Angeles,"Los Angeles, CA",US,United States,34.10585980243645,-118.29797038899477,t,Apartment,Private room,1,0.0,1.0,1.0,Real Bed,"{TV,Internet,Wifi,Kitchen,""Free parking on premises"",""Pets live on this property"",Cat(s),Heating,Washer,Dryer}",$65.00,,"$1,195.00",,$65.00,1,$0.00,30,60,30,30,60,60,30.0,60.0,t,30,60,90,365,15,0,89.0,9.0,9.0,9.0,9.0,10.0,9.0,f,f,f,strict_14_with_grace_period,t,t,1,0,1,0,0.16
143,Large and lovely room in a craftsman home,none,"We are near buses and trains but a car is always preferable.  If you don't rent a car, I would advise to get Uber when you return home at night.  In the day, the public transportation is pretty good but at night it's rather slow.",2010-09-10,"Los Angeles, California, United States",within a day,t,Mid-City,2.0,2.0,t,t,"Los Angeles, CA, United States",Mid-City,Harvard Heights,City of Los Angeles,Los Angeles,CA,90006,Los Angeles,"Los Angeles, CA",US,United States,34.04079366648589,-118.30837447688259,t,House,Private room,2,2.0,1.0,1.0,Futon,"{Internet,Wifi,Kitchen,""Free parking on premises"",""Pets live on this property"",Dog(s),Cat(s),""Free street parking"",""Indoor fireplace"",Heating,""Family/kid friendly"",Washer,Dryer,""Smoke detector"",""Fire extinguisher"",Essentials,Shampoo,""24-hour check-in"",Hangers,""Hair dryer"",Iron,""Laptop friendly workspace"",""Hot water"",Microwave,Refrigerator,""Dishes and silverware"",""Cooking basics"",Oven,Stove,""Garden or backyard"",""Long term stays allowed"",Other}",$50.00,$375.00,"$1,100.00",$100.00,$75.00,2,$0.00,4,90,4,4,90,90,4.0,90.0,t,21,21,21,276,17,2,95.0,10.0,10.0,10.0,10.0,9.0,10.0,f,f,f,strict_14_with_grace_period,f,t,2,0,2,0,0.18
144,Small Studio - Ocean View & Steps from the sand!,none,"Easy to walk to many restaurants and bars in 5 minutes or less. Pharmacies, Whole Foods and other service stores are all 10/15 minutes away. Use the provided bicycles and ride anywhere you want for free! Sorry, NO CAR Parking at the studio. Plenty of free parking in the street.",2010-09-21,"Los Angeles, California, United States",,f,Venice,1.0,1.0,t,t,"Los Angeles, CA, United States",Venice,Venice,City of Los Angeles,Los Angeles,CA,90291,Los Angeles,"Los Angeles, CA",US,United States,33.983712773005216,-118.4699491748317,t,Apartment,Entire home/apt,2,1.0,0.0,1.0,Real Bed,"{TV,Internet,Wifi,Dog(s),Heating,Washer,Dryer,""Smoke detector"",""Carbon monoxide detector"",""First aid kit"",""Fire extinguisher"",Essentials,""24-hour check-in"",Hangers,""Hair dryer"",Iron,""Laptop friendly workspace"",""translation missing: en.hosting_amenity_49"",""translation missing: en.hosting_amenity_50"",""Self check-in"",Keypad,""Private entrance"",""Hot water"",""Bed linens"",Microwave,""Coffee maker"",Refrigerator,""Dishes and silverware"",""Cooking basics"",""Beach essentials"",""Luggage dropoff allowed"",Beachfront}",$95.00,$625.00,,$100.00,$30.00,2,$0.00,2,28,2,2,28,28,2.0,28.0,t,20,41,69,323,300,61,90.0,10.0,9.0,9.0,9.0,10.0,9.0,f,t,f,strict_14_with_grace_period,f,t,1,1,0,0,3.0
145,Cozy cottage,none,Easy public bus transportation in Sunset Blvd,2010-03-11,"Los Angeles, California, United States",within an hour,f,West Hollywood,14.0,14.0,t,f,"Los Angeles, CA, United States",West Hollywood,West Hollywood,Other Cities,Los Angeles,CA,90046,Los Angeles,"Los Angeles, CA",US,United States,34.090313257060004,-118.3627053557888,t,Bungalow,Entire home/apt,2,1.0,1.0,1.0,Real Bed,"{TV,""Cable TV"",Internet,Wifi,""Air conditioning"",Kitchen,""Free street parking"",Heating,""Family/kid friendly"",Washer,Dryer,""Smoke detector"",""Carbon monoxide detector"",""First aid kit"",Essentials,Shampoo,""24-hour check-in"",Hangers,""Hair dryer"",Iron,""Laptop friendly workspace"",""translation missing: en.hosting_amenity_50"",""Private entrance"",""Hot water"",""Long term stays allowed"",Other}",$90.00,$700.00,"$2,550.00",$300.00,$100.00,2,$10.00,31,1125,31,31,1125,1125,31.0,1125.0,t,0,26,56,331,137,12,87.0,9.0,9.0,9.0,9.0,9.0,9.0,f,t,f,strict_14_with_grace_period,f,f,14,14,0,0,1.43
146,"Feel Like Home, in a 700 Sf. of Open Space Guesthouse, with Weekly Maid Service.",none,"Orange bus line, RTD bus line",2011-02-16,"Los Angeles, California, United States",within an hour,t,Encino,2.0,2.0,t,f,"Encino, CA, United States",Encino,Encino,City of Los Angeles,Encino,CA,91316,Los Angeles,"Encino, CA",US,United States,34.182771212990126,-118.52720969616043,t,Guesthouse,Entire home/apt,3,1.0,0.0,0.0,Real Bed,"{TV,""Cable TV"",Internet,Wifi,""Air conditioning"",Pool,Kitchen,""Free street parking"",""Indoor fireplace"",Heating,""Family/kid friendly"",Washer,Dryer,""Smoke detector"",""Carbon monoxide detector"",""First aid kit"",""Fire extinguisher"",Essentials,Shampoo,""24-hour check-in"",Hangers,""Hair dryer"",Iron,""Laptop friendly workspace"",""Private entrance"",""Hot water"",""Body soap"",""Bath towel"",""Toilet paper"",""Bed linens"",""Extra pillows and blankets"",Microwave,""Coffee maker"",Refrigerator,""Dishes and silverware"",""Cooking basics"",Stove,""BBQ grill"",""Patio or balcony"",""Garden or backyard"",""Luggage dropoff allowed"",""Long term stays allowed"",""Wide hallway clearance"",""Wide doorway"",""Accessible-height bed"",""Wide doorway"",""Wide clearance to shower, toilet"",""Wide entryway"",""Host greets you"",""Full kitchen"",""Bedroom comforts"",""Bathroom essentials""}",$99.00,$590.00,"$1,950.00","$5,000.00",$85.00,2,$15.00,2,365,2,2,365,365,2.0,365.0,t,0,0,0,0,82,26,98.0,10.0,10.0,10.0,10.0,10.0,10.0,f,f,f,moderate,f,f,2,2,0,0,0.85
147,GRAND LUX CONDO -Free WiFi!,none,You can walk to the Metro station ( 4 blocks away) or take the buses on Wilshire Blvd.  The 720 rapid buses are the fastest. You can walk to restaurants and bars on 6th street.  Escala has a great happy hour!,2011-02-16,"Los Angeles, California, United States",within an hour,f,East Hollywood,1.0,1.0,t,t,"Los Angeles, CA, United States",East Hollywood,East Hollywood,City of Los Angeles,Los Angeles,CA,90020,Los Angeles,"Los Angeles, CA",US,United States,34.08515540052348,-118.28760451938255,t,Apartment,Entire home/apt,4,1.0,1.0,2.0,Real Bed,"{TV,""Cable TV"",Internet,Wifi,""Air conditioning"",Kitchen,""Free parking on premises"",Elevator,""Free street parking"",""Indoor fireplace"",Heating,""Family/kid friendly"",Washer,Dryer,""Smoke detector"",""Fire extinguisher"",Essentials,Shampoo,Hangers,""Hair dryer"",Iron,""Laptop friendly workspace"",Bathtub,""Hot water"",Microwave,""Coffee maker"",Refrigerator,Dishwasher,""Dishes and silverware"",""Cooking basics"",Oven,Stove,""Single level home"",""Patio or balcony"",""Luggage dropoff allowed"",""Wide hallway clearance"",""Step-free access"",""Wide doorway"",""Flat path to front door"",""Well-lit path to entrance"",""Step-free access"",""Step-free access"",""Wide entryway"",""Host greets you"",""Handheld shower head""}",$115.00,$839.00,,,$55.00,1,$0.00,8,18,8,8,18,18,8.0,18.0,t,23,53,83,173,64,0,98.0,10.0,10.0,10.0,10.0,9.0,10.0,f,t,f,moderate,f,t,1,1,0,0,0.7
148,"Arrival Haven II, The Artist Studio",none,The major 720 bus line traveling from Downtown to the Santa Monica beaches is a 5 walk from the house; it connects with the Metro Rail 2 miles away.,2010-07-09,"Los Angeles, California, United States",within a day,f,Mid-Wilshire,2.0,2.0,t,t,"Los Angeles, CA, United States",Mid-Wilshire,Mid-Wilshire,City of Los Angeles,Los Angeles,CA,90036,Los Angeles,"Los Angeles, CA",US,United States,34.05832396510634,-118.34105108379651,t,House,Private room,2,,1.0,1.0,Real Bed,"{Internet,Wifi,Kitchen,""Pets live on this property"",Cat(s),""Indoor fireplace"",Heating,Washer,Dryer,""Smoke detector"",""First aid kit"",""Safety card"",""Fire extinguisher"",Essentials,Hangers,Iron}",$75.00,$545.00,"$1,750.00",$350.00,,1,$25.00,5,365,5,5,365,365,5.0,365.0,t,30,60,90,365,17,0,97.0,10.0,10.0,10.0,10.0,10.0,10.0,f,f,f,strict_14_with_grace_period,t,t,2,0,2,0,0.18
149,BECAUSE REVIEWS DON'T LIE! Go Instant Book Now!,none,"Q: IS IT EASY TO GET AROUND FROM HERE?  A: CAN REACH ALMOST ANYWHERE In LA fast! We are very centrally located in the middle of where most tourists want to go.. BEACH, DOWNTOWN, HOLLYWOOD & More! BY CAR - UBER - LYFT - BUS - TRAIN - We are accessible by ALL! (But TAKE AN UBER it's THE BEST CHOICE!) MANY attractions are only 20 mins away..  Situated near Downtown LA, West LA, Southbay, Beaches & Hollywood.. LA POINTS OF INTEREST by CAR 15 minutes to Downtown LA. 20 minutes to LAX Airport. 30 minutes to Venice & Santa Monica Beaches. 20 minutes to Hollywood & Melrose Blvds.  40 minutes to Universal Studios & Citywalk. 45 minutes to Disneyland & Knott's Berry Farm. My ADVICE.. This is LA. Do yourself a favor.. Take UBER or RENT A CAR!!  It's a BIG CITY, Buses are slow, packed & sometimes  who wants to spend their trip waiting for buses?? That said.. YES, there is easy access to many bus lines and we are near the train as well. $20 off your first Uber ride! -  OR TRY UBERpool rideshare for",2011-02-22,"Los Angeles, California, United States",within an hour,t,South LA,2.0,2.0,t,t,"Los Angeles, CA, United States",South LA,View Park-Windsor Hills,Unincorporated Areas,Los Angeles,CA,90056,Los Angeles,"Los Angeles, CA",US,United States,33.986007177106444,-118.3579847608682,t,Guesthouse,Entire home/apt,4,1.0,0.0,3.0,Real Bed,"{TV,""Cable TV"",Wifi,""Air conditioning"",Kitchen,""Free parking on premises"",""Smoking allowed"",""Free street parking"",Heating,""Family/kid friendly"",""Smoke detector"",""Carbon monoxide detector"",""First aid kit"",""Fire extinguisher"",Essentials,Shampoo,Hangers,""Hair dryer"",Iron,""Laptop friendly workspace"",""Self check-in"",""Building staff"",""Private entrance"",Crib,""Pack ’n Play/travel crib"",""Room-darkening shades"",""Game console"",""Hot water"",""Bed linens"",""Extra pillows and blankets"",""Ethernet connection"",Microwave,""Coffee maker"",Refrigerator,""Dishes and silverware"",""Cooking basics"",Oven,Stove,""Single level home"",""BBQ grill"",""Patio or balcony"",""Garden or backyard"",""Beach essentials"",""Long term stays allowed"",""Disabled parking spot"",Kitchenette,""Full kitchen""}",$78.00,,"$3,699.00",$0.00,$50.00,1,$5.00,1,28,1,1,28,28,1.0,28.0,t,16,38,67,67,504,64,96.0,10.0,10.0,10.0,10.0,10.0,10.0,f,t,f,strict_14_with_grace_period,f,f,2,2,0,0,5.29
150,Beach close studio with loft in Venice,none,"There are busses on Rose or Lincoln or Main Street and from the train in Santa Monica, you can get downtown to the garment district, the music center, little Tokyo or Chinatown and from there you can take the underground to Hollywood or Universal Studios",2011-02-26,"Los Angeles, California, United States",within an hour,t,Venice,4.0,4.0,t,t,"Los Angeles, CA, United States",Venice,Venice,City of Los Angeles,Los Angeles,CA,90291,Los Angeles,"Los Angeles, CA",US,United States,33.997461042960616,-118.47153060592821,t,Apartment,Entire home/apt,3,1.0,0.0,2.0,Real Bed,"{TV,""Cable TV"",Internet,Wifi,""Air conditioning"",Kitchen,""Free street parking"",Heating,""Family/kid friendly"",Washer,Dryer,""Smoke detector"",""Carbon monoxide detector"",""Fire extinguisher"",Essentials,Shampoo,""24-hour check-in"",Hangers,""Hair dryer"",Iron,""Laptop friendly workspace"",""Self check-in"",Keypad,""Private entrance"",""Hot water"",""Bed linens"",""Extra pillows and blankets"",""Luggage dropoff allowed""}",$135.00,$750.00,"$2,500.00",$200.00,$85.00,2,$10.00,4,28,4,4,28,28,4.0,28.0,t,21,51,81,356,199,34,95.0,10.0,9.0,10.0,10.0,10.0,10.0,f,f,f,moderate,t,t,4,4,0,0,2.08
151,Mid-Century Modern Echo Park Lakefront 2BR Home,none,"If you feel like getting away, you are close to most major freeways (I-5, I- (Phone number hidden by Airbnb) ) as well as to LA's best kept secret, the always wide open Highway 2. While the location is close to the Hollywood freeway, it's far enough away from the noise. It's 5 minutes to Downtown LA, Arts District, Chinatown, Staples Center, Convention Center, LA Live and Silverlake, 10 Minutes to Hollywood and Melrose Avenue, 15 Minutes to Pasadena and Universal Studios, 30 minutes to LAX, Santa Monica, Venice and the beaches. For the fun-loving visitor, we are half-way between Disneyland and Six Flags Magic Mountain! There are 10(!) bus lines passing by within a 5 minute walk from here. They will take you directly to Downtown, Hollywood, Burbank, Glendale, USC, the Westside, the subway, Union Station and the $9.75 FlyAway bus nonstop to and from LAX. Most importantly: Uber and Lyft pick-ups are really quick in this neighborhood.",2011-02-21,"Los Angeles, California, United States",within a day,f,Echo Park,1.0,1.0,t,t,"Los Angeles, CA, United States",,Echo Park,City of Los Angeles,Los Angeles,CA,90026,Los Angeles,"Los Angeles, CA",US,United States,34.07103272283794,-118.26065930917936,t,Apartment,Entire home/apt,3,1.0,2.0,3.0,Real Bed,"{TV,Internet,Wifi,""Air conditioning"",Pool,Kitchen,""Free parking on premises"",""Free street parking"",""Buzzer/wireless intercom"",Heating,Washer,Dryer,""Smoke detector"",""First aid kit"",""Fire extinguisher"",Essentials,Shampoo,Hangers,""Hair dryer"",Iron,""Laptop friendly workspace"",""translation missing: en.hosting_amenity_49"",""translation missing: en.hosting_amenity_50"",""Private entrance"",""Hot water"",""Bed linens"",""Extra pillows and blankets"",""Coffee maker"",Refrigerator,Dishwasher,""Dishes and silverware"",""Cooking basics"",Oven,Stove,""BBQ grill"",""Patio or balcony"",""Luggage dropoff allowed"",Other,Waterfront,""Lake access""}",$149.00,$799.00,,$200.00,,2,$25.00,6,21,6,6,21,21,6.0,21.0,t,0,0,0,24,13,2,92.0,9.0,9.0,9.0,10.0,9.0,9.0,f,f,f,moderate,f,f,1,1,0,0,0.14
152,modern minimalist *city views*patio,none,Bus stops just down the hill on Sunset Blvd. most guests use Uber.  Three blocks to Sunset Blvd. Our place is in the hills of Silver lake.,2011-03-07,"Los Angeles, California, United States",within an hour,t,Silver Lake,3.0,3.0,t,f,"Los Angeles, CA, United States",Silver Lake,Silver Lake,City of Los Angeles,Los Angeles,CA,90026,Los Angeles,"Los Angeles, CA",US,United States,34.083330228941286,-118.27951409644932,t,Apartment,Entire home/apt,3,1.0,1.0,0.0,Real Bed,"{TV,""Cable TV"",Internet,Wifi,""Air conditioning"",Kitchen,""Smoking allowed"",""Pets live on this property"",""Free street parking"",Heating,""Family/kid friendly"",Washer,Dryer,""Smoke detector"",""Carbon monoxide detector"",""First aid kit"",""Safety card"",""Fire extinguisher"",Essentials,Shampoo,Hangers,""Hair dryer"",Iron,""Laptop friendly workspace"",""Self check-in"",Lockbox,""Hot water"",""Coffee maker"",Refrigerator,""Dishes and silverware"",""Cooking basics"",""Patio or balcony"",""Garden or backyard"",""Step-free access"",""Well-lit path to entrance"",""Step-free access""}",$125.00,$800.00,"$3,500.00",$500.00,$75.00,2,$40.00,2,14,2,2,14,14,2.0,14.0,t,28,54,84,359,245,35,96.0,10.0,10.0,10.0,10.0,10.0,9.0,f,t,f,strict_14_with_grace_period,t,t,2,2,0,0,2.61
153,Guest Quarters @ the Hollywood Sign,none,"Hollywood has a metro station which connects to downtown Los Angeles, Universal Studios, Koreatown and Long Beach.  Hollywood is a 45 minute walk down hill but there is bus stop half way that will take you to Hollywood, the Metro station and the LAX bus (to from airport).  That being said, LA is large and spread out.  Mass transportation is not good.  It is best to have a car.",2009-07-29,"Los Angeles, California, United States",within an hour,t,Hollywood Hills,1.0,1.0,t,t,"Los Angeles, CA, United States",Hollywood Hills,Hollywood Hills,City of Los Angeles,Los Angeles,CA,90068,Los Angeles,"Los Angeles, CA",US,United States,34.128586140589384,-118.32020107025177,t,House,Entire home/apt,2,,1.0,1.0,Real Bed,"{""Cable TV"",Wifi,""Air conditioning"",""Free parking on premises"",Heating,Essentials,Shampoo,Hangers,""Hair dryer"",Iron,""translation missing: en.hosting_amenity_49"",""translation missing: en.hosting_amenity_50"",""Private entrance"",""Hot water"",""Bed linens"",Microwave,""Coffee maker"",Refrigerator}",$110.00,,,,,1,$0.00,3,730,3,3,730,730,3.0,730.0,t,1,3,13,164,419,46,98.0,10.0,10.0,10.0,10.0,10.0,10.0,f,f,f,strict_14_with_grace_period,f,f,1,1,0,0,4.4
154,Cozy secluded Guesthouse in Garden,none,"Parking with a guest pass is plentiful in front of our house. Our location is very central and a 5-10 min walk to the 720 Rapid Wilshire  express bus (25-35 mins) and the multi stop Pico #7 bus...both that Santa Monica. that go directly to the beach and to the downtown  area with transfer. The nearest metro rail is located underground at the NE corner of Whilshire/Western (across from the Wiltern theatre), and you can take it downtown to the beautiful Union Station and have an authentic delicious Mexican lunch at one of the restaurants on Olvera street or transfer to another Metrorail lines for other destinations. To visit the museum of Natural History without paying $10-$12 for parking, you can park for free on the SE corner of Jefferson and fairfax and take the metrorail for $1.50, which will take you directly to the Museum of Natural History and USC area. For airport transport without a rental car  Bell Cab is 5 min away and approx $(PHONE NUMBER HIDDEN). Also you can check current ",2011-03-11,"Los Angeles, California, United States",within a few hours,f,Mid-Wilshire,1.0,1.0,t,t,"Los Angeles, CA, United States",Mid-Wilshire,Mid-Wilshire,City of Los Angeles,Los Angeles,CA,90036,Los Angeles,"Los Angeles, CA",US,United States,34.05965764337732,-118.3540246568453,t,Apartment,Entire home/apt,4,1.0,1.0,3.0,Real Bed,"{TV,Internet,Wifi,""Air conditioning"",Kitchen,""Free parking on premises"",""Pets live on this property"",Cat(s),Heating,""Family/kid friendly"",""Smoke detector"",""First aid kit"",Essentials}",$119.00,$700.00,,$0.00,$75.00,2,$15.00,3,60,3,3,60,60,3.0,60.0,t,9,16,46,321,156,6,99.0,10.0,10.0,10.0,10.0,10.0,10.0,f,f,f,strict_14_with_grace_period,f,f,1,1,0,0,1.64
