88,"Studio City ,prime location",none,,2010-07-19,"Los Angeles, California, United States",within a few hours,t,Studio City,5.0,5.0,t,t,"Studio City, CA, United States",,Sherman Oaks,City of Los Angeles,Studio City,CA,91604,Los Angeles,"Studio City, CA",US,United States,34.14090323648457,-118.41521645056959,t,Hostel,Private room,1,1.0,1.0,1.0,Real Bed,"{TV,""Cable TV"",Internet,Wifi,Kitchen,""Free parking on premises"",""Pets live on this property"",Dog(s),""Indoor fireplace"",Heating,""Family/kid friendly"",Washer,Dryer}",$67.00,,"$1,475.00",$500.00,$25.00,1,$20.00,7,90,7,7,90,90,7.0,90.0,t,29,59,89,364,19,1,91.0,9.0,8.0,9.0,9.0,10.0,9.0,f,f,f,strict_14_with_grace_period,f,f,1,0,1,0,0.19
89,Downtown Deluxe 2,none,,2010-06-03,"Los Angeles, California, United States",within an hour,f,,3.0,3.0,t,t,"Los Angeles, CA, United States",Echo Park,Chinatown,City of Los Angeles,Los Angeles,CA,90012,Los Angeles,"Los Angeles, CA",US,United States,34.06407037243722,-118.24337902943992,t,House,Private room,2,,1.0,1.0,Real Bed,"{TV,""Cable TV"",Internet,Wifi,""Air conditioning"",Kitchen,""Free parking on premises"",""Buzzer/wireless intercom"",Heating,""Family/kid friendly"",Essentials,Shampoo,Hangers,""Hair dryer"",Iron,""Laptop friendly workspace"",""Room-darkening shades""}",$79.00,$500.00,"$1,600.00",,$35.00,2,$20.00,1,1125,1,1,1125,1125,1.0,1125.0,t,17,47,77,352,248,20,87.0,9.0,9.0,10.0,10.0,9.0,9.0,f,t,f,moderate,f,f,3,0,3,0,2.42
90,Arts District Private Room 212,none,"GETTING THERE:  From LAX take the FlyAway bus to Union Station, then take the Gold Line to the Little Tokyo stop. The building is two short blocks away.  Or take an Uber Pool or Lyft Line. GETTING AROUND:   Metro Bike Share Station- Nearest is at Traction and Rose, two blocks away.  Use it to explore DTLA! Dash A bus - Stop is at Hewitt and 2nd St, less than a block away.  Use it to explore DTLA!  Fare is 50 cents. Metro subway - Little Tokyo Gold Line stop is two blocks away at Alameda and 1st.  Use it to explore the rest of Los Angeles City and County! PARKING:  Free street street parking is available nearby, otherwise it is $4.00/day at the meters. Metered spots are enforced from 6 am - 4 pm.  There are also paid lots nearby.",2009-11-24,"Los Angeles, California, United States",within an hour,f,Arts District,22.0,22.0,t,t,"Los Angeles, CA, United States",Arts District,Downtown,City of Los Angeles,Los Angeles,CA,90012,Los Angeles,"Los Angeles, CA",US,United States,34.048518007735645,-118.23692599082837,t,Hostel,Private room,1,11.0,1.0,1.0,Real Bed,"{Wifi,Kitchen,""Paid parking off premises"",""Free street parking"",Heating,Washer,Dryer,""Smoke detector"",""Fire extinguisher"",""Lock on bedroom door"",""Self check-in"",Lockbox,""Hot water"",""Bed linens"",Microwave,Refrigerator,""Dishes and silverware"",""Cooking basics"",Oven,Stove,""Long term stays allowed""}",$45.00,$280.00,$825.00,$250.00,$40.00,1,$0.00,2,365,2,2,365,365,2.0,365.0,t,8,38,68,343,63,4,86.0,9.0,8.0,9.0,9.0,9.0,9.0,f,f,f,strict_14_with_grace_period,f,f,22,3,19,0,0.62
91,Private Bath - Beautiful Suite,none,Parking is unrestricted in this area. You need not worry about moving your car. Both the 92 and 96 lines stop steps from the house on Glendale Boulevard.,2010-08-04,"Los Angeles, California, United States",within an hour,t,Silver Lake,3.0,3.0,t,t,"Los Angeles, CA, United States",Silver Lake,Silver Lake,City of Los Angeles,Los Angeles,CA,90039-2715,Los Angeles,"Los Angeles, CA",US,United States,34.10421329357011,-118.26004016626922,t,House,Private room,2,1.0,1.0,1.0,Real Bed,"{TV,""Cable TV"",Wifi,""Air conditioning"",Kitchen,""Free street parking"",Heating,Washer,Dryer,""Smoke detector"",""Carbon monoxide detector"",Essentials,Shampoo,""Lock on bedroom door"",Hangers,""Hair dryer"",Iron,""Laptop friendly workspace"",""translation missing: en.hosting_amenity_49"",""Self check-in"",Lockbox,""Hot water"",""Bed linens"",""Extra pillows and blankets"",Microwave,""Coffee maker"",Refrigerator,""Dishes and silverware"",""Cooking basics"",Oven,Stove,""Patio or balcony"",""Garden or backyard"",""Luggage dropoff allowed"",""Long term stays allowed""}",$52.00,$350.00,"$1,300.00",$0.00,$25.00,1,$0.00,3,730,3,3,730,730,3.0,730.0,t,12,37,66,66,45,24,97.0,10.0,10.0,10.0,10.0,10.0,10.0,f,t,f,moderate,f,f,3,0,3,0,0.44
92,Heart of Hollywood- walk everywhere,none,"The public transit is plentiful -- buses, subway and  two metro stations:  Hollywood and Vine, and Hollywood and Highland. Both are about a 10-15 minute walk. Buses are far closer, and can also take you to the metro.  It's a 5-6 minute walk to the center of all things Hollywood, stores and the Walk of Fame Uber and Lyft  have pick up times of two minutes!-- there's no where that you can't get to from this conveniently located neighborhood, and in this particular part of Hollywood there is very less congestion.",2010-08-06,"Los Angeles, California, United States",,t,Hollywood,2.0,2.0,t,t,"Los Angeles, CA, United States",Hollywood,Hollywood,City of Los Angeles,Los Angeles,CA,90038,Los Angeles,"Los Angeles, CA",US,United States,34.09178691660984,-118.33110505514944,t,Apartment,Entire home/apt,2,1.0,1.0,3.0,Real Bed,"{TV,""Cable TV"",Internet,Wifi,""Air conditioning"",Kitchen,""Free parking on premises"",Breakfast,""Indoor fireplace"",""Buzzer/wireless intercom"",Heating,""Family/kid friendly"",Washer,""Smoke detector"",""Carbon monoxide detector"",""First aid kit"",""Safety card"",""Fire extinguisher"",Essentials,Shampoo,""24-hour check-in"",Hangers,""Hair dryer"",Iron,""Laptop friendly workspace"",""translation missing: en.hosting_amenity_50"",""Self check-in"",Lockbox,""Private entrance"",""Hot water"",""Bed linens"",""Extra pillows and blankets"",Microwave,""Coffee maker"",Refrigerator,Dishwasher,""Dishes and silverware"",""Cooking basics"",Oven,Stove,""Single level home"",""Luggage dropoff allowed"",""Long term stays allowed"",""Wide doorway""}",$175.00,,"$2,900.00",$350.00,$125.00,1,$10.00,10,90,10,10,90,90,10.0,90.0,t,0,0,0,0,87,7,92.0,9.0,9.0,10.0,10.0,9.0,9.0,f,f,f,strict_14_with_grace_period,f,f,2,2,0,0,0.91
93,Perfect Bedroom in Nice House,none,"We are an easy walk to a variety of bus lines on Sepulveda Blvd, Van Nuys Blvd and Vanowen Street that service the city and enable quick access to the Orange Line of the Metro System.  If I'm available I may be able to pick you up from the Van Nuys Flyaway (LAX airport shuttle bus) which costs $9.75, the Van Nuys Amtrak/Metrolink Station and the Sepulveda Orange Line Station. Otherwise Lyft/Uber are readily available.",2010-08-08,"Los Angeles, California, United States",within an hour,f,Van Nuys,4.0,4.0,t,t,"San Fernando Valley, CA, United States",Van Nuys,Van Nuys,City of Los Angeles,San Fernando Valley,CA,91405,Los Angeles,"San Fernando Valley, CA",US,United States,34.196844610428876,-118.45928567984647,t,House,Private room,2,2.0,1.0,1.0,Real Bed,"{TV,""Cable TV"",Wifi,""Air conditioning"",Kitchen,""Free parking on premises"",Breakfast,""Pets live on this property"",Dog(s),Cat(s),""Hot tub"",Heating,Washer,Dryer,""Smoke detector"",""Carbon monoxide detector"",""First aid kit"",""Fire extinguisher"",Essentials,Shampoo,""Lock on bedroom door"",Hangers,Iron,""Laptop friendly workspace"",""translation missing: en.hosting_amenity_49"",""translation missing: en.hosting_amenity_50"",Bathtub,""Hot water"",Microwave,""Coffee maker"",Refrigerator,""Dishes and silverware"",""Cooking basics"",Oven,Stove,""Single level home"",""BBQ grill"",""Patio or balcony"",""Garden or backyard"",""Beach essentials"",""Host greets you""}",$50.00,$300.00,,$0.00,$10.00,1,$15.00,1,6,1,1,6,6,1.0,6.0,t,0,12,41,41,66,2,86.0,9.0,7.0,10.0,10.0,9.0,9.0,f,f,f,flexible,t,f,4,0,4,0,0.65
94,Comfy Couch in Arty Area* ,none,"Buses a block away! Subways from the bus. Close to downtown and Hollywood, too!",2010-07-24,"Los Angeles, California, United States",within a few hours,f,Silver Lake,1.0,1.0,t,t,"Los Angeles, CA, United States",Silver Lake,Silver Lake,City of Los Angeles,Los Angeles,CA,90026,Los Angeles,"Los Angeles, CA",US,United States,34.082733733298674,-118.2703330240562,t,Apartment,Shared room,1,1.0,1.0,1.0,Couch,"{TV,""Cable TV"",Internet,Wifi,Kitchen,""Pets live on this property"",Cat(s),""Buzzer/wireless intercom"",Heating,Washer,Dryer,""Smoke detector"",""Carbon monoxide detector"",""First aid kit"",Essentials,Shampoo}",$49.00,$350.00,"$1,100.00",$200.00,$10.00,1,$0.00,1,5,1,1,5,5,1.0,5.0,t,27,57,87,362,40,3,94.0,10.0,9.0,10.0,10.0,10.0,9.0,f,f,f,moderate,f,f,1,0,0,1,0.81
95,Cute Home in Mount Washington ,none,"It is best if you have a car, the first stop from home is one mile away walk. ",2010-08-14,"Los Angeles, California, United States",within an hour,f,Glassell Park,1.0,1.0,t,t,"Los Angeles, CA, United States",Glassell Park,Glassell Park,City of Los Angeles,Los Angeles,CA,90065,Los Angeles,"Los Angeles, CA",US,United States,34.108373355995504,-118.22411849041984,t,House,Private room,3,1.0,1.0,2.0,Real Bed,"{TV,""Cable TV"",Internet,Wifi,""Air conditioning"",Kitchen,""Free parking on premises"",""Smoking allowed"",""Pets live on this property"",Dog(s),""Free street parking"",Heating,Washer,Dryer,""Smoke detector"",Essentials,""Lock on bedroom door"",Hangers,Iron,""Laptop friendly workspace"",""translation missing: en.hosting_amenity_49"",""translation missing: en.hosting_amenity_50"",""Self check-in"",""Building staff"",""Private entrance"",""Hot water"",""Bed linens"",""Luggage dropoff allowed"",""Long term stays allowed""}",$46.00,$400.00,"$1,097.00",$0.00,$0.00,1,$16.00,3,365,3,3,365,365,3.0,365.0,t,1,1,1,1,17,1,98.0,10.0,9.0,10.0,10.0,9.0,10.0,f,t,f,moderate,t,t,1,0,1,0,0.18
96,Cottage Oasis w Private Terrace- Prime Silver Lake,none,"Our neighborhood itself is very walkable- especially for LA.  We are centrally located- not far from the thriving communities of Echo Park, Atwater Village, downtown LA and Hollywood.   You can get around easily by car- or Uber/Lyft.  Three block from us, buses run east and west on Sunset Boulevard to take you to other parts of the city.  The nearest LA Metro station is about 1 mile from us.  It can take you to downtown LA or Hollywood and beyond.  Lots to do- come explore!",2010-08-14,"Camarillo, California, United States",within an hour,t,Silver Lake,8.0,8.0,t,t,"Los Angeles, CA, United States",Silver Lake,Silver Lake,City of Los Angeles,Los Angeles,CA,90026,Los Angeles,"Los Angeles, CA",US,United States,34.09552777287004,-118.27614402912829,t,Bungalow,Entire home/apt,4,1.0,1.0,1.0,Real Bed,"{TV,""Cable TV"",Internet,Wifi,""Air conditioning"",Kitchen,""Pets allowed"",Heating,""Family/kid friendly"",Washer,Dryer,""Smoke detector"",""Carbon monoxide detector"",""First aid kit"",""Fire extinguisher"",Essentials,Shampoo,""24-hour check-in"",Hangers,""Hair dryer"",Iron,""Laptop friendly workspace"",""Self check-in"",Lockbox,""Private entrance"",Bathtub,""Baby bath"",""High chair"",""Pack ’n Play/travel crib"",""Room-darkening shades"",""Hot water"",""Bed linens"",""Extra pillows and blankets"",""Ethernet connection"",Microwave,""Coffee maker"",Refrigerator,""Dishes and silverware"",""Cooking basics"",Oven,Stove,""Patio or balcony"",""Garden or backyard"",""Luggage dropoff allowed"",""Long term stays allowed""}",$145.00,$850.00,"$3,000.00",$150.00,$65.00,2,$15.00,2,90,2,2,90,90,2.0,90.0,t,13,33,50,317,126,20,98.0,10.0,10.0,10.0,10.0,10.0,10.0,f,f,f,moderate,f,t,5,5,0,0,1.26
97,"BACHELOR STE IN STUDIO CITY, NEAR NBC UNIVERSAL,",none,,2009-12-21,"Los Angeles, California, United States",within a day,f,Studio City,2.0,2.0,t,f,"Studio City, CA, United States",Studio City,Studio City,City of Los Angeles,Studio City,CA,91604,Los Angeles,"Studio City, CA",US,United States,34.135881475338785,-118.41178121901865,t,House,Private room,1,1.0,1.0,1.0,Real Bed,"{TV,""Cable TV"",Wifi,""Air conditioning"",Kitchen,""Free parking on premises"",""Free street parking"",Heating,Washer,Dryer,""Smoke detector"",""Carbon monoxide detector"",""Fire extinguisher"",Essentials,Shampoo,""Lock on bedroom door"",Hangers,""Hair dryer"",""Laptop friendly workspace"",""Self check-in"",Lockbox,""Hot water"",""Bed linens"",""Extra pillows and blankets"",""Luggage dropoff allowed"",""Long term stays allowed""}",$85.00,$400.00,"$1,500.00",$500.00,$35.00,1,$15.00,5,900,5,5,900,900,5.0,900.0,t,0,0,0,0,1,1,80.0,8.0,10.0,10.0,10.0,8.0,6.0,f,t,f,moderate,f,f,2,0,2,0,0.09
98,Cool Bungalow Garden Guesthouse,none,There are local bus lines a block away and the Metro Red Line to Hollywood and Downtown is a 15 minute walk from here.,2010-08-05,"Los Angeles, California, United States",within a few hours,t,East Hollywood,3.0,3.0,t,t,"Los Angeles, CA, United States",East Hollywood,East Hollywood,City of Los Angeles,Los Angeles,CA,90004,Los Angeles,"Los Angeles, CA",US,United States,34.07954149976856,-118.285280844311,t,House,Entire home/apt,2,1.0,1.0,1.0,Real Bed,"{Internet,Wifi,""Air conditioning"",Kitchen,""Pets live on this property"",Cat(s),Heating,Washer,Dryer,""Smoke detector"",""Carbon monoxide detector"",""First aid kit"",Essentials,Shampoo,""translation missing: en.hosting_amenity_49"",""translation missing: en.hosting_amenity_50""}",$69.00,$475.00,"$1,800.00",$200.00,$60.00,1,$10.00,31,85,31,31,85,85,31.0,85.0,t,0,0,7,282,79,6,96.0,10.0,10.0,10.0,10.0,9.0,10.0,f,f,f,strict_14_with_grace_period,f,f,2,2,0,0,0.79
99,"Motel Rm $350 week , Free wifi /ac/micro/fridge",none,,2010-08-08,"Lynwood, California, United States",within a few hours,f,Lynwood,6.0,6.0,t,t,"Lynwood, CA, United States",Lynwood,Lynwood,Other Cities,Lynwood,CA,90262,Los Angeles,"Lynwood, CA",US,United States,33.91833502084528,-118.20868901829408,t,Hotel,Private room,2,1.0,1.0,1.0,Real Bed,"{TV,""Cable TV"",Wifi,""Air conditioning"",""Free parking on premises"",""Free street parking"",Heating,Washer,Dryer,""Smoke detector"",""Fire extinguisher"",Essentials,Shampoo,Hangers,""Hair dryer"",Iron,""Laptop friendly workspace"",""Self check-in"",""Building staff"",""Hot water"",""Luggage dropoff allowed"",""Long term stays allowed""}",$58.00,$285.00,,,,1,$0.00,1,365,1,1,365,365,1.0,365.0,t,26,36,61,150,134,9,92.0,10.0,9.0,10.0,10.0,7.0,9.0,f,f,f,flexible,f,f,6,0,6,0,1.46
100,3 Bed House/ Hot Tub & Fire Lounge,none,,2010-08-23,"Culver City, California, United States",within a few hours,t,Culver City,2.0,2.0,t,t,"Culver City, CA, United States",Culver City,Culver City,Other Cities,Culver City,CA,90232,Los Angeles,"Culver City, CA",US,United States,34.012773993660396,-118.40829855267508,t,House,Entire home/apt,6,2.0,3.0,3.0,Real Bed,"{TV,""Cable TV"",Internet,Wifi,Kitchen,""Free parking on premises"",""Hot tub"",Heating,""Family/kid friendly"",Washer,Dryer,""Smoke detector"",""Carbon monoxide detector"",""Fire extinguisher"",Essentials,Shampoo,""24-hour check-in"",Hangers,""Hair dryer"",Iron,Microwave,""Coffee maker"",Refrigerator,Dishwasher,""Dishes and silverware"",""Cooking basics"",Oven,Stove,""Single level home"",""BBQ grill"",""Patio or balcony"",""Garden or backyard""}",$275.00,,,$500.00,$125.00,6,$30.00,2,30,2,2,30,30,2.0,30.0,t,2,12,33,259,106,25,98.0,10.0,10.0,10.0,10.0,10.0,10.0,f,f,f,strict_14_with_grace_period,f,f,2,2,0,0,1.1
101,Private Guest House in Top Location,none,"The Subway to Universal Studios or Downtown is at Hollywood Blvd & Vine Street; a 15 min walk from the house.  The bus-metro line 222 has a stop on Cahuenga Blvd, just a couple of min and there's also a LA Dash (smaller bus) which takes it's round every 30 min.  LA Metro Bus:  (Website hidden by Airbnb)  Hollywood Dash Bus:  (Website hidden by Airbnb)",2010-08-24,"Los Angeles, California, United States",within an hour,f,Hollywood Hills,3.0,3.0,t,t,"Hollywood, CA, United States",Hollywood Hills,Hollywood Hills,City of Los Angeles,Hollywood,CA,90068,Los Angeles,"Hollywood, CA",US,United States,34.11365695224812,-118.33104802649376,t,House,Entire home/apt,2,1.0,1.0,1.0,Real Bed,"{TV,""Cable TV"",Internet,Wifi,""Air conditioning"",Kitchen,""Free parking on premises"",""Free street parking"",Heating,""Smoke detector"",""Fire extinguisher"",Essentials,Shampoo,""24-hour check-in"",Hangers,""Hair dryer"",Iron,""Laptop friendly workspace"",""Private entrance"",""High chair"",""Hot water"",""Bed linens"",""Coffee maker"",Refrigerator,""Dishes and silverware"",""Cooking basics"",Oven,""Garden or backyard"",""Luggage dropoff allowed"",""Well-lit path to entrance"",""Step-free access"",""Wide clearance to bed"",""Step-free access"",""Wide doorway"",""Step-free access"",""Host greets you""}",$109.00,,,$200.00,$45.00,2,$25.00,2,365,2,2,365,365,2.0,365.0,t,14,34,51,282,370,56,96.0,10.0,10.0,10.0,10.0,10.0,10.0,f,f,f,strict_14_with_grace_period,f,t,3,2,1,0,3.65
102,Los Feliz-Spacious and Bright Room,none,"public transportation is 5 minutes away, on Los Feliz blvd",2010-08-27,"Los Angeles, California, United States",,t,Hollywood,5.0,5.0,t,t,"Los Angeles, CA, United States",Los Feliz,Los Feliz,City of Los Angeles,Los Angeles,CA,90027,Los Angeles,"Los Angeles, CA",US,United States,34.110359418453896,-118.27576720552273,f,Apartment,Private room,3,1.0,1.0,1.0,Futon,"{TV,Internet,Wifi,Kitchen,Heating,""Family/kid friendly"",Washer,Dryer,""Smoke detector"",""Carbon monoxide detector"",""Fire extinguisher"",Essentials,Shampoo,Hangers,""Hair dryer"",Iron,""Laptop friendly workspace"",""Private entrance"",""Hot water"",""Bed linens"",""Extra pillows and blankets""}",$65.00,$420.00,"$1,700.00",$100.00,$30.00,1,$20.00,1,30,1,1,30,30,1.0,30.0,t,30,60,90,269,54,10,95.0,10.0,10.0,10.0,10.0,10.0,10.0,f,f,f,strict_14_with_grace_period,f,f,2,0,1,1,0.71
103,Malibu Ocean View Rooms for Rent 3,none,,2010-08-28,"Malibu, California, United States",within an hour,t,Malibu,5.0,5.0,t,f,"Malibu, CA, United States",Malibu,Malibu,Other Cities,Malibu,CA,90265,Malibu,"Malibu, CA",US,United States,34.02956378895855,-118.75531958263436,t,House,Private room,4,1.0,1.0,1.0,Real Bed,"{TV,""Cable TV"",Internet,Wifi,""Air conditioning"",Pool,Kitchen,""Free parking on premises"",Heating,""Family/kid friendly"",Washer,Dryer,""Smoke detector"",""Carbon monoxide detector"",""First aid kit"",""Fire extinguisher"",Essentials,Shampoo,""Lock on bedroom door"",Hangers,""Hair dryer"",Iron,""Laptop friendly workspace"",""Private entrance"",""Hot water"",Microwave,""Coffee maker"",Refrigerator,Dishwasher,""Dishes and silverware"",""Patio or balcony"",""Garden or backyard"",""Luggage dropoff allowed"",""Long term stays allowed"",""Host greets you"",Beachfront}",$300.00,"$1,400.00","$5,000.00",,$50.00,2,$70.00,1,365,1,1,365,365,1.0,365.0,t,30,60,90,365,127,13,98.0,10.0,10.0,10.0,10.0,10.0,9.0,f,t,f,moderate,f,f,5,1,4,0,1.41
104,One Bedroom in Venice/MarinadelRey,none,"bus lines to all nearby cities, very close to airport...",2010-08-30,"Los Angeles, California, United States",,f,Culver City,1.0,1.0,t,t,"Los Angeles, CA, United States",Culver City,Culver City,Other Cities,Los Angeles,CA,90066,Los Angeles,"Los Angeles, CA",US,United States,33.993554413532244,-118.44283520987284,t,House,Private room,2,1.0,1.0,1.0,Real Bed,"{Wifi,Kitchen,""Free parking on premises"",""Washer / Dryer"",""Pets live on this property"",""Hot tub"",Washer,Dryer}",$100.00,$500.00,"$1,800.00",,,1,$0.00,2,730,2,2,730,730,2.0,730.0,t,0,0,0,0,3,0,100.0,10.0,10.0,10.0,10.0,10.0,9.0,f,f,f,flexible,f,f,1,0,1,0,0.06
105,Valley Oasis / Pvt Rm & bathroom,none,"I  require a rental car or individual transportation as public transit in Los Angeles is difficult and time consuming.  So, rent a car here in ""the valley"" or rent one at LAX (more expensive)  Uber and Lyft are much more expensive to use from here vs. a rental car.",2010-09-03,"Los Angeles, California, United States",within a few hours,t,Granada Hills North,1.0,1.0,t,f,"Granada Hills, (Los Angeles), CA, United States",Granada Hills North,Granada Hills,City of Los Angeles,"Granada Hills, (Los Angeles)",CA,91344,Los Angeles,"Granada Hills, (Los Angeles), CA",US,United States,34.277401343066344,-118.47957654701702,t,House,Private room,2,1.0,1.0,1.0,Real Bed,"{""Cable TV"",Wifi,""Air conditioning"",Pool,Kitchen,""Free parking on premises"",""Smoking allowed"",""Pets live on this property"",Dog(s),""Free street parking"",""Hot tub"",""Indoor fireplace"",Heating,""Family/kid friendly"",Washer,Dryer,""Smoke detector"",""Carbon monoxide detector"",""First aid kit"",""Fire extinguisher"",Essentials,Shampoo,Hangers,""Hair dryer"",Iron,""Laptop friendly workspace"",""translation missing: en.hosting_amenity_50"",""Self check-in"",Lockbox,""Hot water"",""Bed linens"",""Extra pillows and blankets"",Microwave,""Coffee maker"",Refrigerator,Dishwasher,""Dishes and silverware"",""Cooking basics"",Oven,Stove,""Single level home"",""BBQ grill"",""Patio or balcony"",""Garden or backyard"",""Beach essentials"",""Luggage dropoff allowed""}",$53.00,$420.00,,$200.00,$40.00,2,$10.00,3,14,3,3,14,14,3.0,14.0,t,29,59,89,364,153,15,98.0,10.0,10.0,10.0,10.0,10.0,10.0,f,f,f,moderate,t,f,1,0,1,0,1.6
106,Guest House - Nightly or Weekly,none,Great public transportation.  Busses a half block away that run from Downtown to Santa Monica.  The Hollywood and Highland Red Line is a twenty minute walk or five minutes by bus.,2009-10-29,US,within a few hours,t,Hollywood,1.0,1.0,t,f,"Los Angeles, CA, United States",Hollywood,Hollywood,City of Los Angeles,Los Angeles,CA,90046,Los Angeles,"Los Angeles, CA",US,United States,34.09595543218756,-118.34985121652045,t,Guesthouse,Entire home/apt,2,1.0,1.0,1.0,Real Bed,"{Wifi,""Air conditioning"",""Wheelchair accessible"",Kitchen,""Pets allowed"",""Pets live on this property"",Dog(s),Cat(s),""Free street parking"",Heating,Washer,Dryer,""Smoke detector"",""Carbon monoxide detector"",Essentials,Hangers,""Hair dryer"",Iron,""Laptop friendly workspace"",""Private entrance"",""Hot water"",""Bed linens"",Microwave,""Coffee maker"",Refrigerator,""Dishes and silverware"",""Cooking basics"",Oven,Stove,""Single level home"",""BBQ grill"",""Garden or backyard"",""Luggage dropoff allowed"",""Long term stays allowed"",""Step-free access"",""Host greets you""}",$130.00,$550.00,"$2,000.00",$0.00,$0.00,1,$0.00,2,730,2,2,730,730,2.0,730.0,t,10,36,66,66,68,36,94.0,10.0,9.0,10.0,10.0,10.0,9.0,f,f,f,strict_14_with_grace_period,f,f,1,1,0,0,0.67
107,"Charming, SPACIOUS room for rent",none,"A car is preferable.  However, we are near all buses and trains.  At night, though, one should take Uber or a taxi if it's late.",2010-09-10,"Los Angeles, California, United States",within a day,t,Mid-City,2.0,2.0,t,t,"Los Angeles, CA, United States",Mid-City,Harvard Heights,City of Los Angeles,Los Angeles,CA,90006,Los Angeles,"Los Angeles, CA",US,United States,34.04095467997277,-118.30650979894878,t,House,Private room,2,2.0,2.0,1.0,Futon,"{Internet,Wifi,Kitchen,""Free parking on premises"",""Pets live on this property"",Dog(s),Cat(s),""Free street parking"",""Indoor fireplace"",Heating,Washer,Dryer,""Smoke detector"",""Fire extinguisher"",Essentials,Shampoo,""Lock on bedroom door"",""24-hour check-in"",Hangers,""Hair dryer"",Iron,""Laptop friendly workspace"",""translation missing: en.hosting_amenity_49"",""translation missing: en.hosting_amenity_50"",""Hot water"",""Bed linens"",Microwave,Refrigerator,""Dishes and silverware"",""Cooking basics"",Oven,Stove,""Long term stays allowed"",""Host greets you""}",$50.00,$375.00,"$1,100.00",$100.00,$75.00,2,$0.00,3,200,3,3,200,200,3.0,200.0,t,0,0,21,218,73,6,98.0,10.0,9.0,10.0,10.0,9.0,10.0,f,f,f,strict_14_with_grace_period,f,t,2,0,2,0,0.75
108,Spanish Bungalow Guest House LA CA.,none,a few block walk to major transportation street,2010-09-15,"Los Angeles, California, United States",,t,Atwater Village,1.0,1.0,t,t,"Los Angeles, CA, United States",Atwater Village,Atwater Village,City of Los Angeles,Los Angeles,CA,90039,Los Angeles,"Los Angeles, CA",US,United States,34.12025579278933,-118.26772761122164,t,Bungalow,Entire home/apt,2,1.0,1.0,1.0,Real Bed,"{TV,""Air conditioning"",Kitchen,""Free street parking"",Heating,""Smoke detector"",""Carbon monoxide detector"",""Fire extinguisher"",Essentials,Hangers,Iron,""Private entrance"",""Hot water"",Microwave,""Coffee maker"",Refrigerator,""Dishes and silverware"",""Cooking basics"",Stove,""Host greets you""}",$72.00,$472.00,"$1,850.00",$250.00,$0.00,1,$0.00,3,365,3,3,365,365,3.0,365.0,t,17,47,77,352,120,17,93.0,10.0,9.0,10.0,10.0,10.0,10.0,f,f,f,flexible,f,f,1,1,0,0,1.24
109,Guest House with Hot Tub,none,Plentiful street parking with no restrictions . Major bus lines are a few blocks away.,2010-09-16,"Los Angeles, California, United States",within an hour,f,Mar Vista,1.0,1.0,t,t,"Los Angeles, CA, United States",Mar Vista,Mar Vista,City of Los Angeles,Los Angeles,CA,90066,Los Angeles,"Los Angeles, CA",US,United States,34.00580764407597,-118.44356477524157,t,Guesthouse,Entire home/apt,2,1.0,0.0,1.0,Pull-out Sofa,"{TV,""Cable TV"",Wifi,""Air conditioning"",Kitchen,""Free street parking"",""Hot tub"",Heating,Washer,Dryer,""Smoke detector"",""Carbon monoxide detector"",""First aid kit"",""Fire extinguisher"",Essentials,Shampoo,""Lock on bedroom door"",Hangers,""Hair dryer"",Iron,""Laptop friendly workspace"",""translation missing: en.hosting_amenity_49"",""translation missing: en.hosting_amenity_50"",""Self check-in"",Lockbox,""Private living room"",""Private entrance"",""Hot water"",""Bed linens"",""Extra pillows and blankets"",Microwave,""Coffee maker"",Refrigerator,""Dishes and silverware"",""Cooking basics"",""Single level home"",""Patio or balcony"",""Garden or backyard"",""Beach essentials"",""Luggage dropoff allowed"",""Long term stays allowed"",""Wide hallway clearance"",""Step-free access"",""Well-lit path to entrance"",""Step-free access"",""Wide clearance to bed"",""Step-free access"",""Wide entryway"",""Handheld shower head""}",$109.00,$615.00,"$2,900.00",$300.00,$75.00,1,$0.00,3,365,3,3,365,365,3.0,365.0,t,21,51,81,356,256,40,95.0,10.0,10.0,10.0,10.0,10.0,10.0,f,f,f,strict_14_with_grace_period,t,t,1,1,0,0,2.54
